question_id,question_text,answer,question_title,hashtags,topics_algebra,topics_geometry,topics_trignometry,topics_arithmetic,calculator,answer_type,chart,length
problem1143,The world has the habit of making room for the man whose actions show that he knows where he is going.,1143,Napoleon Hill,"Algebra,Trignometry,Calculator,Grid-In,Chart,Short",Algebra,,Trignometry,,Calculator,Grid-In,Chart,Short
problem1144,"You cannot step twice into the same river, for other waters are continually flowing in.",1144,Heraclitus,"Algebra,Geometry,Calculator,Grid-In,No Chart,Long",Algebra,Geometry,,,Calculator,Grid-In,No Chart,Long
problem1145,Excellence is to do a common thing in an uncommon way.,1145,Booker Washington,"Trignometry,Calculator,Multiple Choice,No Chart,Long",,,Trignometry,,Calculator,Multiple Choice,No Chart,Long
problem1146,"No matter how hard the past, you can always begin again.",1146,Buddha,"Algebra,Arithmetic,Calculator,Multiple Choice,No Chart,Long",Algebra,,,Arithmetic,Calculator,Multiple Choice,No Chart,Long
problem1147,I begin with an idea and then it becomes something else.,1147,Pablo Picasso,"Geometry,Arithmetic,Calculator,Grid-In,No Chart,Long",,Geometry,,Arithmetic,Calculator,Grid-In,No Chart,Long
problem1148,"Whoever is happy will make others happy, too.",1148,Mark Twain,"Algebra,Geometry,Trignometry,Calculator,Multiple Choice,Chart,Long",Algebra,Geometry,Trignometry,,Calculator,Multiple Choice,Chart,Long
problem1149,Your work is to discover your work and then with all your heart to give yourself to it.,1149,Buddha,"Geometry,Arithmetic,Calculator,Multiple Choice,Chart,Short",,Geometry,,Arithmetic,Calculator,Multiple Choice,Chart,Short
problem1150,"It's not what happens to you, but how you react to it that matters.",1150,Epictetus,"Trignometry,No Calculator,Multiple Choice,Chart,Long",,,Trignometry,,No Calculator,Multiple Choice,Chart,Long
problem1151,"Take it easy, but take it.",1151,Woody Guthrie,"Geometry,Trignometry,Arithmetic,No Calculator,Multiple Choice,No Chart,Long",,Geometry,Trignometry,Arithmetic,No Calculator,Multiple Choice,No Chart,Long
problem1152,"Never apologize for showing feeling. When you do so, you apologize for truth.",1152,Benjamin Disraeli,"Geometry,Arithmetic,Calculator,Multiple Choice,Chart,Short",,Geometry,,Arithmetic,Calculator,Multiple Choice,Chart,Short
problem1153,Take rest; a field that has rested gives a bountiful crop.,1153,Ovid,"Algebra,Calculator,Multiple Choice,Chart,Long",Algebra,,,,Calculator,Multiple Choice,Chart,Long
problem1154,"Age does not protect you from love. But love, to some extent, protects you from age.",1154,Anais Nin,"Algebra,Arithmetic,No Calculator,Grid-In,No Chart,Long",Algebra,,,Arithmetic,No Calculator,Grid-In,No Chart,Long
problem1155,Do what you can. Want what you have. Be who you are.,1155,Forrest Church,"Arithmetic,No Calculator,Multiple Choice,No Chart,Long",,,,Arithmetic,No Calculator,Multiple Choice,No Chart,Long
problem1156,There are people who have money and people who are rich.,1156,Coco Chanel,"Algebra,Trignometry,Calculator,Multiple Choice,No Chart,Short",Algebra,,Trignometry,,Calculator,Multiple Choice,No Chart,Short
problem1157,"Why worry about tomorrow, when today is all we have?",1157,Master Yoda,"Algebra,Trignometry,No Calculator,Multiple Choice,Chart,Short",Algebra,,Trignometry,,No Calculator,Multiple Choice,Chart,Short
problem1158,Speak when you are angry and you will make the best speech you will ever regret.,1158,Ambrose Bierce,"Algebra,Geometry,Arithmetic,Calculator,Grid-In,No Chart,Long",Algebra,Geometry,,Arithmetic,Calculator,Grid-In,No Chart,Long
problem1159,"Things do not change, we change.",1159,Henry Thoreau,"Geometry,Trignometry,Arithmetic,Calculator,Grid-In,No Chart,Long",,Geometry,Trignometry,Arithmetic,Calculator,Grid-In,No Chart,Long
problem1160,The exercise of an extraordinary gift is the supremest pleasure in life.,1160,Mark Twain,"Geometry,Trignometry,Calculator,Multiple Choice,Chart,Short",,Geometry,Trignometry,,Calculator,Multiple Choice,Chart,Short
problem1161,Sometimes the most important thing in a whole day is the rest we take between two deep breaths.,1161,Etty Hillesum,"Trignometry,Arithmetic,Calculator,Multiple Choice,Chart,Short",,,Trignometry,Arithmetic,Calculator,Multiple Choice,Chart,Short
problem1162,Forgiveness is choosing to love. It is the first skill of self-giving love.,1162,Mohandas Gandhi,"Geometry,No Calculator,Multiple Choice,Chart,Short",,Geometry,,,No Calculator,Multiple Choice,Chart,Short
problem1163,"To ensure good health: eat lightly, breathe deeply, live moderately, cultivate cheerfulness, and maintain an interest in life.",1163,William Londen,"Trignometry,No Calculator,Grid-In,No Chart,Long",,,Trignometry,,No Calculator,Grid-In,No Chart,Long
problem1164,Most smiles are started by another smile.,1164,Voldemort,"Trignometry,Arithmetic,No Calculator,Multiple Choice,No Chart,Long",,,Trignometry,Arithmetic,No Calculator,Multiple Choice,No Chart,Long
problem1165,"Nothing is softer or more flexible than water, yet nothing can resist it.",1165,Lao Tzu,"Geometry,Arithmetic,Calculator,Multiple Choice,Chart,Short",,Geometry,,Arithmetic,Calculator,Multiple Choice,Chart,Short
problem1166,It is difficult to achieve a spirit of genuine cooperation as long as people remain indifferent to the feelings and happiness of others.,1166,Dalai Lama,"Algebra,Geometry,Arithmetic,Calculator,Grid-In,Chart,Long",Algebra,Geometry,,Arithmetic,Calculator,Grid-In,Chart,Long
problem1167,"Experience keeps a dear school, but fools will learn in no other.",1167,Benjamin Franklin,"Geometry,Trignometry,Arithmetic,No Calculator,Multiple Choice,Chart,Long",,Geometry,Trignometry,Arithmetic,No Calculator,Multiple Choice,Chart,Long
problem1168,We can only be said to be alive in those moments when our hearts are conscious of our treasures.,1168,Thornton Wilder,"Geometry,Arithmetic,No Calculator,Grid-In,No Chart,Short",,Geometry,,Arithmetic,No Calculator,Grid-In,No Chart,Short
problem1169,Fine words and an insinuating appearance are seldom associated with true virtue,1169,Confucius,"Calculator,Grid-In,Chart,Short",,,,,Calculator,Grid-In,Chart,Short
problem1170,"We do not quit playing because we grow old, we grow old because we quit playing.",1170,Oliver Holmes,"Geometry,Arithmetic,Calculator,Multiple Choice,Chart,Short",,Geometry,,Arithmetic,Calculator,Multiple Choice,Chart,Short
problem1171,You can't choose up sides on a round world.,1171,Wayne Dyer,"No Calculator,Grid-In,No Chart,Long",,,,,No Calculator,Grid-In,No Chart,Long
problem1172,Kindness is the language which the deaf can hear and the blind can see.,1172,Mark Twain,"Algebra,Trignometry,Arithmetic,Calculator,Grid-In,Chart,Short",Algebra,,Trignometry,Arithmetic,Calculator,Grid-In,Chart,Short
problem1173,"I may not know everything, but everything is not known yet anyway.",1173,Byron Pulsifer,"Algebra,Geometry,Arithmetic,Calculator,Multiple Choice,No Chart,Long",Algebra,Geometry,,Arithmetic,Calculator,Multiple Choice,No Chart,Long
problem1174,"If we could see the miracle of a single flower clearly, our whole life would change.",1174,Buddha,"Algebra,Trignometry,Arithmetic,Calculator,Multiple Choice,Chart,Long",Algebra,,Trignometry,Arithmetic,Calculator,Multiple Choice,Chart,Long
problem1175,Without this playing with fantasy no creative work has ever yet come to birth. The debt we owe to the play of the imagination is incalculable.,1175,Carl Jung,"No Calculator,Multiple Choice,No Chart,Long",,,,,No Calculator,Multiple Choice,No Chart,Long
problem1176,You cannot travel the path until you have become the path itself.,1176,Buddha,"Trignometry,Arithmetic,No Calculator,Multiple Choice,Chart,Long",,,Trignometry,Arithmetic,No Calculator,Multiple Choice,Chart,Long
problem1177,Keep your eyes on the stars and your feet on the ground.,1177,Theodore Roosevelt,"Trignometry,Arithmetic,No Calculator,Grid-In,Chart,Long",,,Trignometry,Arithmetic,No Calculator,Grid-In,Chart,Long
problem1178,"I am not afraid of tomorrow, for I have seen yesterday and I love today.",1178,William White,"Algebra,Arithmetic,Calculator,Multiple Choice,No Chart,Long",Algebra,,,Arithmetic,Calculator,Multiple Choice,No Chart,Long
problem1179,"Limitations live only in our minds. But if we use our imaginations, our possibilities become limitless.",1179,Jamie Paolinetti,"Algebra,Geometry,Trignometry,Arithmetic,Calculator,Multiple Choice,No Chart,Long",Algebra,Geometry,Trignometry,Arithmetic,Calculator,Multiple Choice,No Chart,Long
problem1180,"When you lose, don't lose the lesson.",1180,,"Algebra,Arithmetic,Calculator,Multiple Choice,No Chart,Short",Algebra,,,Arithmetic,Calculator,Multiple Choice,No Chart,Short
problem1181,"If you want a thing done well, do it yourself.",1181,Napoleon Bonaparte,"Algebra,Geometry,Trignometry,Calculator,Grid-In,Chart,Long",Algebra,Geometry,Trignometry,,Calculator,Grid-In,Chart,Long
problem1182,The greatest barrier to success is the fear of failure.,1182,Eriksson,"Algebra,Trignometry,Calculator,Multiple Choice,No Chart,Long",Algebra,,Trignometry,,Calculator,Multiple Choice,No Chart,Long
problem1183,"Sunshine is delicious, rain is refreshing, wind braces us up, snow is exhilarating; there is really no such thing as bad weather, only different kinds of good weather.",1183,John Ruskin,"Geometry,Calculator,Multiple Choice,Chart,Long",,Geometry,,,Calculator,Multiple Choice,Chart,Long
problem1184,"If you aren't going all the way, why go at all?",1184,Joe Namath,"Geometry,No Calculator,Grid-In,Chart,Short",,Geometry,,,No Calculator,Grid-In,Chart,Short
problem1185,"Our greatest glory is not in never falling, but in rising every time we fall.",1185,Confucius,"Algebra,Geometry,Trignometry,No Calculator,Grid-In,No Chart,Short",Algebra,Geometry,Trignometry,,No Calculator,Grid-In,No Chart,Short
problem1186,"The beginning of wisdom is found in doubting; by doubting we come to the question, and by seeking we may come upon the truth.",1186,Pierre Abelard,"Geometry,Trignometry,No Calculator,Multiple Choice,No Chart,Long",,Geometry,Trignometry,,No Calculator,Multiple Choice,No Chart,Long
problem1187,"If I could reach up and hold a star for every time you've made me smile, the entire evening sky would be in the palm of my hand.",1187,Master Yoda,"Algebra,Calculator,Multiple Choice,Chart,Short",Algebra,,,,Calculator,Multiple Choice,Chart,Short
problem1188,"We are shaped by our thoughts; we become what we think. When the mind is pure, joy follows like a shadow that never leaves.",1188,Buddha,"Algebra,Trignometry,Arithmetic,Calculator,Grid-In,Chart,Short",Algebra,,Trignometry,Arithmetic,Calculator,Grid-In,Chart,Short
problem1189,"Stay committed to your decisions, but stay flexible in your approach.",1189,Tony Robbins,"Geometry,Trignometry,No Calculator,Multiple Choice,No Chart,Short",,Geometry,Trignometry,,No Calculator,Multiple Choice,No Chart,Short
problem1190,"An optimist is a person who sees a green light everywhere, while the pessimist sees only the red spotlight... The truly wise person is colour-blind.",1190,Albert Schweitzer,"Algebra,Trignometry,Arithmetic,No Calculator,Multiple Choice,Chart,Long",Algebra,,Trignometry,Arithmetic,No Calculator,Multiple Choice,Chart,Long
problem1191,What separates the winners from the losers is how a person reacts to each new twist of fate.,1191,Donald Trump,"No Calculator,Grid-In,Chart,Short",,,,,No Calculator,Grid-In,Chart,Short
problem1192,Each man has his own vocation; his talent is his call. There is one direction in which all space is open to him.,1192,Ralph Emerson,"Algebra,Trignometry,Arithmetic,No Calculator,Multiple Choice,Chart,Long",Algebra,,Trignometry,Arithmetic,No Calculator,Multiple Choice,Chart,Long
problem1193,"Just as a flower, which seems beautiful has color but no perfume, so are the fruitless words of a man who speaks them but does them not.",1193,Dhammapada,"Algebra,Geometry,Calculator,Grid-In,Chart,Short",Algebra,Geometry,,,Calculator,Grid-In,Chart,Short
problem1194,"To change ones life, start immediately, do it flamboyantly, no exceptions.",1194,William James,"Geometry,Calculator,Grid-In,Chart,Long",,Geometry,,,Calculator,Grid-In,Chart,Long
problem1195,"As we express our gratitude, we must never forget that the highest appreciation is not to utter words, but to live by them.",1195,John F. Kennedy,"Algebra,Geometry,Trignometry,No Calculator,Grid-In,No Chart,Long",Algebra,Geometry,Trignometry,,No Calculator,Grid-In,No Chart,Long
problem1196,The world cares very little about what a man or woman knows; it is what a man or woman is able to do that counts.,1196,Booker Washington,"Arithmetic,Calculator,Grid-In,Chart,Short",,,,Arithmetic,Calculator,Grid-In,Chart,Short
problem1197,The steeper the mountain the harder the climb the better the view from the finishing line,1197,Voldemort,"Geometry,Trignometry,Arithmetic,No Calculator,Multiple Choice,No Chart,Short",,Geometry,Trignometry,Arithmetic,No Calculator,Multiple Choice,No Chart,Short
problem1198,"Aim for success, not perfection. Never give up your right to be wrong, because then you will lose the ability to learn new things and move forward with your life.",1198,Dr. David M. Burns,"Algebra,Arithmetic,No Calculator,Grid-In,Chart,Long",Algebra,,,Arithmetic,No Calculator,Grid-In,Chart,Long
problem1199,"When I let go of what I am, I become what I might be.",1199,Lao Tzu,"Trignometry,No Calculator,Multiple Choice,No Chart,Short",,,Trignometry,,No Calculator,Multiple Choice,No Chart,Short
problem1200,Transformation does not start with some one else changing you; transformation is an inner self reworking of what you are now to what you will be.,1200,Byron Pulsifer,"Geometry,Trignometry,Calculator,Grid-In,Chart,Short",,Geometry,Trignometry,,Calculator,Grid-In,Chart,Short
problem1201,Time is not a measure the length of a day or month or year but more a measure of what you have accomplished.,1201,Byron Pulsifer,"Algebra,Geometry,Calculator,Multiple Choice,No Chart,Long",Algebra,Geometry,,,Calculator,Multiple Choice,No Chart,Long
problem1202,"Wherever a man may happen to turn, whatever a man may undertake, he will always end up by returning to the path which nature has marked out for him.",1202,Johann Wolfgang von Goethe,"Algebra,Geometry,Trignometry,No Calculator,Grid-In,Chart,Long",Algebra,Geometry,Trignometry,,No Calculator,Grid-In,Chart,Long
problem1203,Holding on to anger is like grasping a hot coal with the intent of throwing it at someone else; you are the one who gets burned.,1203,Buddha,"Algebra,Geometry,Trignometry,Arithmetic,Calculator,Grid-In,No Chart,Long",Algebra,Geometry,Trignometry,Arithmetic,Calculator,Grid-In,No Chart,Long
problem1204,"When there is no enemy within, the enemies outside cannot hurt you.",1204,African proverb,"Algebra,Calculator,Grid-In,Chart,Short",Algebra,,,,Calculator,Grid-In,Chart,Short
problem1205,"He who controls others may be powerful, but he who has mastered himself is mightier still.",1205,Lao Tzu,"Algebra,Trignometry,Arithmetic,No Calculator,Grid-In,No Chart,Long",Algebra,,Trignometry,Arithmetic,No Calculator,Grid-In,No Chart,Long
problem1206,There is no scarcity of opportunity to make a living at what you love; theres only scarcity of resolve to make it happen.,1206,Wayne Dyer,"Trignometry,Arithmetic,No Calculator,Multiple Choice,Chart,Long",,,Trignometry,Arithmetic,No Calculator,Multiple Choice,Chart,Long
problem1207,"Neither a lofty degree of intelligence nor imagination nor both together go to the making of genius. Love, love, love, that is the soul of genius.",1207,Wolfgang Amadeus Mozart,"Algebra,Trignometry,Arithmetic,Calculator,Multiple Choice,No Chart,Short",Algebra,,Trignometry,Arithmetic,Calculator,Multiple Choice,No Chart,Short
problem1208,The happy and efficient people in this world are those who accept trouble as a normal detail of human life and resolve to capitalize it when it comes along.,1208,H. Bertram Lewis,"Algebra,Geometry,Arithmetic,No Calculator,Grid-In,No Chart,Long",Algebra,Geometry,,Arithmetic,No Calculator,Grid-In,No Chart,Long
problem1209,"As an organizer I start from where the world is, as it is, not as I would like it to be.",1209,Saul Alinsky,"Geometry,Calculator,Grid-In,Chart,Long",,Geometry,,,Calculator,Grid-In,Chart,Long
problem1210,You are the only person on Earth who can use your ability.,1210,Zig Ziglar,"Algebra,Geometry,Calculator,Grid-In,Chart,Long",Algebra,Geometry,,,Calculator,Grid-In,Chart,Long
problem1211,Don't let what you can't do stop you from doing what you can do.,1211,,"Trignometry,No Calculator,Multiple Choice,Chart,Long",,,Trignometry,,No Calculator,Multiple Choice,Chart,Long
problem1212,Complaining doesn't change a thing only taking action does.,1212,Byron Pulsifer,"Geometry,Arithmetic,Calculator,Multiple Choice,Chart,Long",,Geometry,,Arithmetic,Calculator,Multiple Choice,Chart,Long
problem1213,"Life a culmination of the past, an awareness of the present, an indication of the future beyond knowledge, the quality that gives a touch of divinity to matter.",1213,Charles A. Lindbergh,"Geometry,Trignometry,Arithmetic,Calculator,Grid-In,No Chart,Short",,Geometry,Trignometry,Arithmetic,Calculator,Grid-In,No Chart,Short
problem1214,"Enjoy the little things, for one day you may look back and realize they were the big things.",1214,Robert Brault,"Algebra,Calculator,Multiple Choice,No Chart,Short",Algebra,,,,Calculator,Multiple Choice,No Chart,Short
problem1215,"With every experience, you alone are painting your own canvas, thought by thought, choice by choice.",1215,Oprah Winfrey,"Geometry,Arithmetic,No Calculator,Multiple Choice,Chart,Long",,Geometry,,Arithmetic,No Calculator,Multiple Choice,Chart,Long
problem1216,Let the beauty of what you love be what you do.,1216,Rumi,"Geometry,Trignometry,Arithmetic,Calculator,Multiple Choice,Chart,Long",,Geometry,Trignometry,Arithmetic,Calculator,Multiple Choice,Chart,Long
problem1217,The world turns aside to let any man pass who knows where he is going.,1217,Epictetus,"Algebra,Geometry,Arithmetic,Calculator,Grid-In,Chart,Long",Algebra,Geometry,,Arithmetic,Calculator,Grid-In,Chart,Long
problem1218,Beauty is not in the face; beauty is a light in the heart.,1218,Kahlil Gibran,"Arithmetic,No Calculator,Grid-In,Chart,Short",,,,Arithmetic,No Calculator,Grid-In,Chart,Short
problem1219,A day of worry is more exhausting than a day of work.,1219,John Lubbock,"Algebra,Arithmetic,No Calculator,Multiple Choice,Chart,Long",Algebra,,,Arithmetic,No Calculator,Multiple Choice,Chart,Long
problem1220,"Truth, and goodness, and beauty are but different faces of the same all.",1220,Ralph Emerson,"Algebra,Geometry,Arithmetic,No Calculator,Grid-In,No Chart,Long",Algebra,Geometry,,Arithmetic,No Calculator,Grid-In,No Chart,Long
problem1221,To be great is to be misunderstood.,1221,Ralph Emerson,"Algebra,Geometry,Arithmetic,Calculator,Grid-In,Chart,Short",Algebra,Geometry,,Arithmetic,Calculator,Grid-In,Chart,Short
problem1222,"Trust only movement. Life happens at the level of events, not of words. Trust movement.",1222,Alfred Adler,"Calculator,Grid-In,Chart,Short",,,,,Calculator,Grid-In,Chart,Short
problem1223,"Never, never, never give up.",1223,Winston Churchill,"Algebra,Geometry,Trignometry,Arithmetic,Calculator,Grid-In,Chart,Long",Algebra,Geometry,Trignometry,Arithmetic,Calculator,Grid-In,Chart,Long
problem1224,The most decisive actions of our life... are most often unconsidered actions.,1224,Andre Gide,"Algebra,Geometry,No Calculator,Grid-In,No Chart,Short",Algebra,Geometry,,,No Calculator,Grid-In,No Chart,Short
problem1225,"As we grow as unique persons, we learn to respect the uniqueness of others.",1225,Robert Schuller,"Arithmetic,No Calculator,Multiple Choice,No Chart,Long",,,,Arithmetic,No Calculator,Multiple Choice,No Chart,Long
problem1226,Failure doesn't mean you are a failure it just means you haven't succeeded yet.,1226,Robert Schuller,"Algebra,No Calculator,Grid-In,No Chart,Short",Algebra,,,,No Calculator,Grid-In,No Chart,Short
problem1227,"It is the quality of our work which will please God, not the quantity.",1227,Mahatma Gandhi,"Algebra,Geometry,Arithmetic,No Calculator,Grid-In,Chart,Long",Algebra,Geometry,,Arithmetic,No Calculator,Grid-In,Chart,Long
problem1228,"Try and fail, but don't fail to try.",1228,Stephen Kaggwa,"Geometry,Calculator,Multiple Choice,Chart,Long",,Geometry,,,Calculator,Multiple Choice,Chart,Long
problem1229,First say to yourself what you would be; and then do what you have to do.,1229,Epictetus,"Geometry,Arithmetic,Calculator,Multiple Choice,No Chart,Long",,Geometry,,Arithmetic,Calculator,Multiple Choice,No Chart,Long
problem1230,"Through pride we are ever deceiving ourselves. But deep down below the surface of the average conscience a still, small voice says to us, Something is out of tune.",1230,Carl Jung,"Algebra,Geometry,Trignometry,Arithmetic,No Calculator,Grid-In,Chart,Short",Algebra,Geometry,Trignometry,Arithmetic,No Calculator,Grid-In,Chart,Short
problem1231,"Keep silence for the most part, and speak only when you must, and then briefly.",1231,Epictetus,"Algebra,Trignometry,Calculator,Multiple Choice,Chart,Short",Algebra,,Trignometry,,Calculator,Multiple Choice,Chart,Short
problem1232,"Fear not for the future, weep not for the past.",1232,Percy Shelley,"Algebra,Calculator,Grid-In,No Chart,Short",Algebra,,,,Calculator,Grid-In,No Chart,Short
problem1233,We are Divine enough to ask and we are important enough to receive.,1233,Wayne Dyer,"Algebra,Trignometry,Calculator,Grid-In,Chart,Long",Algebra,,Trignometry,,Calculator,Grid-In,Chart,Long
problem1234,"If you kick a stone in anger, you'll hurt your own foot.",1234,Korean proverb,"Arithmetic,No Calculator,Grid-In,No Chart,Long",,,,Arithmetic,No Calculator,Grid-In,No Chart,Long
problem1235,"To see things in the seed, that is genius.",1235,Lao Tzu,"Algebra,Trignometry,No Calculator,Multiple Choice,No Chart,Long",Algebra,,Trignometry,,No Calculator,Multiple Choice,No Chart,Long
problem1236,The happiness that is genuinely satisfying is accompanied by the fullest exercise of our faculties and the fullest realization of the world in which we live.,1236,Bertrand Russell,"Algebra,Geometry,Trignometry,Arithmetic,No Calculator,Multiple Choice,No Chart,Short",Algebra,Geometry,Trignometry,Arithmetic,No Calculator,Multiple Choice,No Chart,Short
problem1237,"Human beings, who are almost unique in having the ability to learn from the experience of others, are also remarkable for their apparent disinclination to do so.",1237,Douglas Adams,"Algebra,Geometry,Trignometry,Calculator,Grid-In,Chart,Short",Algebra,Geometry,Trignometry,,Calculator,Grid-In,Chart,Short
problem1238,"Make the most of yourself, for that is all there is of you.",1238,Ralph Emerson,"Algebra,Geometry,Trignometry,Arithmetic,No Calculator,Grid-In,Chart,Long",Algebra,Geometry,Trignometry,Arithmetic,No Calculator,Grid-In,Chart,Long
problem1239,"The universe is made of stories, not atoms.",1239,Muriel Rukeyser,"Algebra,Arithmetic,No Calculator,Multiple Choice,No Chart,Long",Algebra,,,Arithmetic,No Calculator,Multiple Choice,No Chart,Long
problem1240,"Respect should be earned by actions, and not acquired by years.",1240,Frank Wright,"Algebra,Geometry,Trignometry,Arithmetic,No Calculator,Multiple Choice,No Chart,Short",Algebra,Geometry,Trignometry,Arithmetic,No Calculator,Multiple Choice,No Chart,Short
problem1241,I hear and I forget. I see and I remember. I do and I understand.,1241,Confucius,"Algebra,Geometry,Trignometry,Calculator,Grid-In,Chart,Long",Algebra,Geometry,Trignometry,,Calculator,Grid-In,Chart,Long
problem1242,The trouble with most people is that they think with their hopes or fears or wishes rather than with their minds.,1242,Will Durant,"Algebra,Geometry,Trignometry,Arithmetic,Calculator,Multiple Choice,Chart,Long",Algebra,Geometry,Trignometry,Arithmetic,Calculator,Multiple Choice,Chart,Long
problem1243,A lot of people give up just before theyre about to make it. You know you never know when that next obstacle is going to be the last one.,1243,Chuck Norris,"Algebra,Geometry,Trignometry,Arithmetic,Calculator,Grid-In,Chart,Long",Algebra,Geometry,Trignometry,Arithmetic,Calculator,Grid-In,Chart,Long
problem1244,Sometimes the biggest act of courage is a small one.,1244,Lauren Raffo,"Trignometry,No Calculator,Grid-In,No Chart,Short",,,Trignometry,,No Calculator,Grid-In,No Chart,Short
problem1245,"People are not lazy. They simply have impotent goals, that is, goals that do not inspire them.",1245,Tony Robbins,"Algebra,Trignometry,Arithmetic,Calculator,Grid-In,No Chart,Long",Algebra,,Trignometry,Arithmetic,Calculator,Grid-In,No Chart,Long
problem1246,"You do not become good by trying to be good, but by finding the goodness that is already within you.",1246,Eckhart Tolle,"Trignometry,Arithmetic,No Calculator,Grid-In,No Chart,Short",,,Trignometry,Arithmetic,No Calculator,Grid-In,No Chart,Short
problem1247,Waste no more time arguing about what a good man should be. Be one.,1247,Marcus Aurelius,"Algebra,Trignometry,No Calculator,Multiple Choice,Chart,Long",Algebra,,Trignometry,,No Calculator,Multiple Choice,Chart,Long
problem1248,Happiness often sneaks in through a door you didn't know you left open.,1248,John Barrymore,"Algebra,Geometry,Trignometry,No Calculator,Grid-In,No Chart,Short",Algebra,Geometry,Trignometry,,No Calculator,Grid-In,No Chart,Short
problem1249,"There are basically two types of people. People who accomplish things, and people who claim to have accomplished things. The first group is less crowded.",1249,Mark Twain,"Algebra,Arithmetic,Calculator,Grid-In,Chart,Long",Algebra,,,Arithmetic,Calculator,Grid-In,Chart,Long
problem1250,The things that one most wants to do are the things that are probably most worth doing.,1250,Winifred Holtby,"Calculator,Grid-In,Chart,Short",,,,,Calculator,Grid-In,Chart,Short
problem1251,Always bear in mind that your own resolution to succeed is more important than any one thing.,1251,Abraham Lincoln,"Algebra,Calculator,Multiple Choice,No Chart,Long",Algebra,,,,Calculator,Multiple Choice,No Chart,Long
