question_id,question_text,answer,question_title,hashtags,topics_algebra,topics_geometry,topics_trignometry,topics_arithmetic,calculator,answer_type,chart,length
problem488,"People are so constituted that everybody would rather undertake what they see others do, whether they have an aptitude for it or not.",488,Johann Wolfgang von Goethe,"Algebra,No Calculator,Grid-In,No Chart,Short",Algebra,,,,No Calculator,Grid-In,No Chart,Short
problem489,We are either progressing or retrograding all the while. There is no such thing as remaining stationary in this life.,489,James Freeman Clarke,"Calculator,Grid-In,Chart,Short",,,,,Calculator,Grid-In,Chart,Short
problem490,The possession of knowledge does not kill the sense of wonder and mystery. There is always more mystery.,490,Anais Nin,"Algebra,Trignometry,No Calculator,Grid-In,No Chart,Short",Algebra,,Trignometry,,No Calculator,Grid-In,No Chart,Short
problem491,"Everything that happens happens as it should, and if you observe carefully, you will find this to be so.",491,Marcus Aurelius,"Geometry,Trignometry,Arithmetic,Calculator,Grid-In,Chart,Short",,Geometry,Trignometry,Arithmetic,Calculator,Grid-In,Chart,Short
problem492,"What we think determines what happens to us, so if we want to change our lives, we need to stretch our minds.",492,Wayne Dyer,"Arithmetic,Calculator,Grid-In,Chart,Short",,,,Arithmetic,Calculator,Grid-In,Chart,Short
problem493,"In a controversy the instant we feel anger we have already ceased striving for the truth, and have begun striving for ourselves.",493,Buddha,"Geometry,Calculator,Grid-In,No Chart,Short",,Geometry,,,Calculator,Grid-In,No Chart,Short
problem494,"It is the greatest of all mistakes to do nothing because you can only do little, do what you can.",494,Sydney Smith,"Algebra,Geometry,Trignometry,Arithmetic,No Calculator,Multiple Choice,Chart,Short",Algebra,Geometry,Trignometry,Arithmetic,No Calculator,Multiple Choice,Chart,Short
problem495,"When you see a man of worth, think of how you may emulate him. When you see one who is unworthy, examine yourself.",495,Confucius,"Algebra,Geometry,Arithmetic,No Calculator,Grid-In,No Chart,Short",Algebra,Geometry,,Arithmetic,No Calculator,Grid-In,No Chart,Short
problem496,"Aerodynamically the bumblebee shouldn't be able to fly, but the bumblebee doesn't know that so it goes on flying anyway.",496,Mary Kay Ash,"Trignometry,Arithmetic,Calculator,Multiple Choice,Chart,Long",,,Trignometry,Arithmetic,Calculator,Multiple Choice,Chart,Long
problem497,Those who try to do something and fail are infinitely better than those who try nothing and succeed.,497,Lloyd Jones,"Calculator,Multiple Choice,No Chart,Long",,,,,Calculator,Multiple Choice,No Chart,Long
problem498,"Snowflakes are one of natures most fragile things, but just look what they can do when they stick together.",498,Vista Kelly,"Algebra,Geometry,Trignometry,Arithmetic,No Calculator,Grid-In,No Chart,Long",Algebra,Geometry,Trignometry,Arithmetic,No Calculator,Grid-In,No Chart,Long
problem499,The first step to getting the things you want out of life is this: decide what you want.,499,Ben Stein,"Calculator,Grid-In,No Chart,Short",,,,,Calculator,Grid-In,No Chart,Short
problem500,Why compare yourself with others? No one in the entire world can do a better job of being you than you.,500,Master Yoda,"Geometry,Trignometry,Calculator,Grid-In,Chart,Long",,Geometry,Trignometry,,Calculator,Grid-In,Chart,Long
problem501,Experience is not what happens to a man. It is what a man does with what happens to him.,501,Aldous Huxley,"Algebra,Geometry,Arithmetic,No Calculator,Grid-In,Chart,Short",Algebra,Geometry,,Arithmetic,No Calculator,Grid-In,Chart,Short
problem502,"A good teacher is like a candle, it consumes itself to light the way for others.",502,Master Yoda,"Geometry,Trignometry,Arithmetic,No Calculator,Multiple Choice,No Chart,Short",,Geometry,Trignometry,Arithmetic,No Calculator,Multiple Choice,No Chart,Short
problem503,The only thing to do with good advice is to pass it on. It is never of any use to oneself.,503,Oscar Wilde,"Geometry,Arithmetic,Calculator,Multiple Choice,Chart,Long",,Geometry,,Arithmetic,Calculator,Multiple Choice,Chart,Long
problem504,"Life is not measured by the breaths we take, but by the moments that take our breath.",504,Master Yoda,"Geometry,Trignometry,Arithmetic,Calculator,Grid-In,Chart,Short",,Geometry,Trignometry,Arithmetic,Calculator,Grid-In,Chart,Short
problem505,"The smallest flower is a thought, a life answering to some feature of the Great Whole, of whom they have a persistent intuition.",505,Honore de Balzac,"Algebra,Trignometry,Calculator,Grid-In,No Chart,Long",Algebra,,Trignometry,,Calculator,Grid-In,No Chart,Long
problem506,Consider how hard it is to change yourself and you'll understand what little chance you have in trying to change others.,506,Jacob Braude,"Geometry,Calculator,Grid-In,Chart,Long",,Geometry,,,Calculator,Grid-In,Chart,Long
problem507,"If you'll not settle for anything less than your best, you will be amazed at what you can accomplish in your lives.",507,Vince Lombardi,"Geometry,Arithmetic,No Calculator,Grid-In,Chart,Long",,Geometry,,Arithmetic,No Calculator,Grid-In,Chart,Long
problem508,What lies behind us and what lies before us are small matters compared to what lies within us.,508,Oliver Holmes,"Algebra,Arithmetic,Calculator,Multiple Choice,No Chart,Short",Algebra,,,Arithmetic,Calculator,Multiple Choice,No Chart,Short
problem509,"With the realization of ones own potential and self-confidence in ones ability, one can build a better world.",509,Dalai Lama,"Trignometry,Arithmetic,No Calculator,Grid-In,No Chart,Short",,,Trignometry,Arithmetic,No Calculator,Grid-In,No Chart,Short
problem510,There is nothing like returning to a place that remains unchanged to find the ways in which you yourself have altered.,510,Nelson Mandela,"Algebra,Calculator,Multiple Choice,Chart,Long",Algebra,,,,Calculator,Multiple Choice,Chart,Long
problem511,Forget about all the reasons why something may not work. You only need to find one good reason why it will.,511,Robert Anthony,"Trignometry,Arithmetic,Calculator,Multiple Choice,Chart,Short",,,Trignometry,Arithmetic,Calculator,Multiple Choice,Chart,Short
problem512,It is the mark of an educated mind to be able to entertain a thought without accepting it.,512,Aristotle,"Algebra,Trignometry,No Calculator,Grid-In,No Chart,Short",Algebra,,Trignometry,,No Calculator,Grid-In,No Chart,Short
problem513,"Love is never lost. If not reciprocated, it will flow back and soften and purify the heart.",513,Washington Irving,"Algebra,No Calculator,Multiple Choice,No Chart,Short",Algebra,,,,No Calculator,Multiple Choice,No Chart,Short
problem514,We all live with the objective of being happy; our lives are all different and yet the same.,514,Anne Frank,"Algebra,Geometry,Calculator,Grid-In,Chart,Long",Algebra,Geometry,,,Calculator,Grid-In,Chart,Long
problem515,Many people think of prosperity that concerns money only to forget that true prosperity is of the mind.,515,Byron Pulsifer,"Geometry,Arithmetic,Calculator,Multiple Choice,Chart,Short",,Geometry,,Arithmetic,Calculator,Multiple Choice,Chart,Short
problem516,To be beautiful means to be yourself. You don't need to be accepted by others. You need to accept yourself.,516,Thich Nhat Hanh,"Algebra,Geometry,No Calculator,Multiple Choice,Chart,Long",Algebra,Geometry,,,No Calculator,Multiple Choice,Chart,Long
problem517,"Do not overrate what you have received, nor envy others. He who envies others does not obtain peace of mind.",517,Buddha,"Algebra,Calculator,Multiple Choice,Chart,Long",Algebra,,,,Calculator,Multiple Choice,Chart,Long
problem518,It is very easy to forgive others their mistakes; it takes more grit to forgive them for having witnessed your own.,518,Jessamyn West,"Geometry,Trignometry,No Calculator,Multiple Choice,Chart,Short",,Geometry,Trignometry,,No Calculator,Multiple Choice,Chart,Short
problem519,"Bodily exercise, when compulsory, does no harm to the body; but knowledge which is acquired under compulsion obtains no hold on the mind.",519,Plato,"Algebra,Calculator,Multiple Choice,Chart,Long",Algebra,,,,Calculator,Multiple Choice,Chart,Long
problem520,"Always be yourself, express yourself, have faith in yourself, do not go out and look for a successful personality and duplicate it.",520,Bruce Lee,"Trignometry,Arithmetic,Calculator,Multiple Choice,No Chart,Long",,,Trignometry,Arithmetic,Calculator,Multiple Choice,No Chart,Long
problem521,"Let us revere, let us worship, but erect and open-eyed, the highest, not the lowest; the future, not the past!",521,Charlotte Gilman,"Trignometry,Arithmetic,No Calculator,Grid-In,No Chart,Short",,,Trignometry,Arithmetic,No Calculator,Grid-In,No Chart,Short
problem522,"Every time you smile at someone, it is an action of love, a gift to that person, a beautiful thing.",522,Mother Teresa,"Algebra,Trignometry,Arithmetic,No Calculator,Grid-In,Chart,Short",Algebra,,Trignometry,Arithmetic,No Calculator,Grid-In,Chart,Short
problem523,Silences make the real conversations between friends. Not the saying but the never needing to say is what counts.,523,Margaret Runbeck,"No Calculator,Multiple Choice,No Chart,Short",,,,,No Calculator,Multiple Choice,No Chart,Short
problem524,The key to transforming our hearts and minds is to have an understanding of how our thoughts and emotions work.,524,Dalai Lama,"Algebra,Trignometry,No Calculator,Grid-In,Chart,Long",Algebra,,Trignometry,,No Calculator,Grid-In,Chart,Long
problem525,"If you must tell me your opinions, tell me what you believe in. I have plenty of douts of my own.",525,Johann Wolfgang von Goethe,"Algebra,Arithmetic,No Calculator,Multiple Choice,No Chart,Short",Algebra,,,Arithmetic,No Calculator,Multiple Choice,No Chart,Short
problem526,"Chance is always powerful. Let your hook be always cast; in the pool where you least expect it, there will be a fish.",526,Ovid,"Algebra,Trignometry,No Calculator,Multiple Choice,No Chart,Short",Algebra,,Trignometry,,No Calculator,Multiple Choice,No Chart,Short
problem527,"I seek constantly to improve my manners and graces, for they are the sugar to which all are attracted.",527,Og Mandino,"Geometry,Arithmetic,Calculator,Multiple Choice,Chart,Short",,Geometry,,Arithmetic,Calculator,Multiple Choice,Chart,Short
problem528,We never understand how little we need in this world until we know the loss of it.,528,James Barrie,"Calculator,Multiple Choice,Chart,Short",,,,,Calculator,Multiple Choice,Chart,Short
problem529,The real measure of your wealth is how much youd be worth if you lost all your money.,529,Master Yoda,"Calculator,Grid-In,No Chart,Long",,,,,Calculator,Grid-In,No Chart,Long
problem530,To keep the body in good health is a duty... otherwise we shall not be able to keep our mind strong and clear.,530,Buddha,"Algebra,No Calculator,Grid-In,No Chart,Long",Algebra,,,,No Calculator,Grid-In,No Chart,Long
problem531,Take no thought of who is right or wrong or who is better than. Be not for or against.,531,Bruce Lee,"Algebra,No Calculator,Multiple Choice,Chart,Short",Algebra,,,,No Calculator,Multiple Choice,Chart,Short
problem532,"I am a man of fixed and unbending principles, the first of which is to be flexible at all times.",532,Everett Dirksen,"Geometry,Trignometry,Arithmetic,Calculator,Grid-In,Chart,Short",,Geometry,Trignometry,Arithmetic,Calculator,Grid-In,Chart,Short
problem533,"Today, give a stranger a smile without waiting for it may be the joy they need to have a great day.",533,Byron Pulsifer,"Geometry,Trignometry,Arithmetic,Calculator,Multiple Choice,No Chart,Short",,Geometry,Trignometry,Arithmetic,Calculator,Multiple Choice,No Chart,Short
problem534,"The moment one gives close attention to anything, even a blade of grass, it becomes a mysterious, awesome, indescribably magnificent world in itself.",534,Henry Miller,"Algebra,Geometry,Trignometry,Arithmetic,No Calculator,Multiple Choice,Chart,Long",Algebra,Geometry,Trignometry,Arithmetic,No Calculator,Multiple Choice,Chart,Long
problem535,At the center of your being you have the answer; you know who you are and you know what you want.,535,Lao Tzu,"Arithmetic,Calculator,Multiple Choice,No Chart,Long",,,,Arithmetic,Calculator,Multiple Choice,No Chart,Long
problem536,How wonderful that we have met with a paradox. Now we have some hope of making progress.,536,Niels Bohr,"Geometry,Trignometry,No Calculator,Multiple Choice,Chart,Long",,Geometry,Trignometry,,No Calculator,Multiple Choice,Chart,Long
problem537,Everyone is a genius at least once a year. A real genius has his original ideas closer together.,537,Georg Lichtenberg,"Geometry,Trignometry,Arithmetic,Calculator,Grid-In,No Chart,Short",,Geometry,Trignometry,Arithmetic,Calculator,Grid-In,No Chart,Short
problem538,Dreams pass into the reality of action. From the actions stems the dream again; and this interdependence produces the highest form of living.,538,Anais Nin,"Trignometry,Arithmetic,Calculator,Grid-In,Chart,Long",,,Trignometry,Arithmetic,Calculator,Grid-In,Chart,Long
problem539,"Without leaps of imagination, or dreaming, we lose the excitement of possibilities. Dreaming, after all, is a form of planning.",539,Gloria Steinem,"Algebra,Geometry,Trignometry,Calculator,Multiple Choice,Chart,Long",Algebra,Geometry,Trignometry,,Calculator,Multiple Choice,Chart,Long
problem540,Sadness may be part of life but there is no need to let it dominate your entire life.,540,Byron Pulsifer,"Trignometry,Arithmetic,No Calculator,Multiple Choice,Chart,Long",,,Trignometry,Arithmetic,No Calculator,Multiple Choice,Chart,Long
problem541,"Keeping a little ahead of conditions is one of the secrets of business, the trailer seldom goes far.",541,Charles Schwab,"Algebra,Trignometry,No Calculator,Grid-In,No Chart,Long",Algebra,,Trignometry,,No Calculator,Grid-In,No Chart,Long
problem542,Nature gave us one tongue and two ears so we could hear twice as much as we speak.,542,Epictetus,"Algebra,Trignometry,Calculator,Grid-In,Chart,Long",Algebra,,Trignometry,,Calculator,Grid-In,Chart,Long
problem543,Don't wait for your feelings to change to take the action. Take the action and your feelings will change.,543,Barbara Baron,"Algebra,Geometry,Trignometry,Arithmetic,No Calculator,Multiple Choice,Chart,Long",Algebra,Geometry,Trignometry,Arithmetic,No Calculator,Multiple Choice,Chart,Long
problem544,"You are always free to change your mind and choose a different future, or a different past.",544,Richard Bach,"Arithmetic,No Calculator,Grid-In,Chart,Long",,,,Arithmetic,No Calculator,Grid-In,Chart,Long
problem545,"You were not born a winner, and you were not born a loser. You are what you make yourself be.",545,Lou Holtz,"Algebra,Trignometry,No Calculator,Multiple Choice,No Chart,Short",Algebra,,Trignometry,,No Calculator,Multiple Choice,No Chart,Short
problem546,"Cherish your visions and your dreams as they are the children of your soul, the blueprints of your ultimate achievements.",546,Napoleon Hill,"Algebra,Trignometry,Arithmetic,Calculator,Grid-In,No Chart,Short",Algebra,,Trignometry,Arithmetic,Calculator,Grid-In,No Chart,Short
problem547,Cherish your visions and your dreams as they are the children of your soul; the blueprints of your ultimate achievements.,547,Napoleon Hill,"Algebra,Geometry,Calculator,Grid-In,Chart,Long",Algebra,Geometry,,,Calculator,Grid-In,Chart,Long
problem548,"To be what we are, and to become what we are capable of becoming, is the only end of life.",548,Robert Stevenson,"Algebra,Geometry,Trignometry,Calculator,Multiple Choice,Chart,Short",Algebra,Geometry,Trignometry,,Calculator,Multiple Choice,Chart,Short
problem549,The road leading to a goal does not separate you from the destination; it is essentially a part of it.,549,Charles DeLint,"Trignometry,No Calculator,Multiple Choice,Chart,Short",,,Trignometry,,No Calculator,Multiple Choice,Chart,Short
problem550,Take things as they are. Punch when you have to punch. Kick when you have to kick.,550,Bruce Lee,"Geometry,No Calculator,Multiple Choice,No Chart,Short",,Geometry,,,No Calculator,Multiple Choice,No Chart,Short
problem551,"I believe that a simple and unassuming manner of life is best for everyone, best both for the body and the mind.",551,Albert Einstein,"Trignometry,No Calculator,Multiple Choice,Chart,Short",,,Trignometry,,No Calculator,Multiple Choice,Chart,Short
problem552,"Though no one can go back and make a brand new start, anyone can start from now and make a brand new ending.",552,Voldemort,"Geometry,Trignometry,Arithmetic,No Calculator,Multiple Choice,No Chart,Long",,Geometry,Trignometry,Arithmetic,No Calculator,Multiple Choice,No Chart,Long
problem553,"Mind is everything: muscle, pieces of rubber. All that I am, I am because of my mind.",553,Paavo Nurmi,"Trignometry,Arithmetic,Calculator,Grid-In,No Chart,Long",,,Trignometry,Arithmetic,Calculator,Grid-In,No Chart,Long
problem554,How wonderful it is that nobody need wait a single moment before starting to improve the world.,554,Anne Frank,"Trignometry,Calculator,Grid-In,Chart,Long",,,Trignometry,,Calculator,Grid-In,Chart,Long
problem555,"A friend is someone who understands your past, believes in your future, and accepts you just the way you are.",555,Voldemort,"Arithmetic,No Calculator,Multiple Choice,Chart,Long",,,,Arithmetic,No Calculator,Multiple Choice,Chart,Long
problem556,It is one of the blessings of old friends that you can afford to be stupid with them.,556,Ralph Emerson,"Calculator,Multiple Choice,No Chart,Short",,,,,Calculator,Multiple Choice,No Chart,Short
problem557,"He that never changes his opinions, never corrects his mistakes, and will never be wiser on the morrow than he is today.",557,Tryon Edwards,"Geometry,Arithmetic,Calculator,Grid-In,Chart,Short",,Geometry,,Arithmetic,Calculator,Grid-In,Chart,Short
problem558,Give me six hours to chop down a tree and I will spend the first four sharpening the axe.,558,Abraham Lincoln,"Algebra,Trignometry,Calculator,Grid-In,No Chart,Long",Algebra,,Trignometry,,Calculator,Grid-In,No Chart,Long
problem559,One must be fond of people and trust them if one is not to make a mess of life.,559,E. M. Forster,"Algebra,No Calculator,Multiple Choice,Chart,Long",Algebra,,,,No Calculator,Multiple Choice,Chart,Long
problem560,"We cannot change our memories, but we can change their meaning and the power they have over us.",560,David Seamans,"Algebra,Trignometry,No Calculator,Grid-In,No Chart,Short",Algebra,,Trignometry,,No Calculator,Grid-In,No Chart,Short
problem561,"Being in humaneness is good. If we select other goodness and thus are far apart from humaneness, how can we be the wise?",561,Confucius,"Trignometry,No Calculator,Grid-In,No Chart,Long",,,Trignometry,,No Calculator,Grid-In,No Chart,Long
problem562,To give hope to someone occurs when you teach them how to use the tools to do it for themselves.,562,Byron Pulsifer,"Algebra,Arithmetic,Calculator,Grid-In,Chart,Short",Algebra,,,Arithmetic,Calculator,Grid-In,Chart,Short
problem563,Id rather regret the things that I have done than the things that I have not done.,563,Lucille Ball,"Trignometry,No Calculator,Multiple Choice,Chart,Long",,,Trignometry,,No Calculator,Multiple Choice,Chart,Long
problem564,The past has no power to stop you from being present now. Only your grievance about the past can do that.,564,Eckhart Tolle,"Algebra,Geometry,Arithmetic,Calculator,Multiple Choice,Chart,Long",Algebra,Geometry,,Arithmetic,Calculator,Multiple Choice,Chart,Long
problem565,If the stars should appear but one night every thousand years how man would marvel and adore.,565,Ralph Emerson,"Algebra,Trignometry,Arithmetic,Calculator,Multiple Choice,No Chart,Short",Algebra,,Trignometry,Arithmetic,Calculator,Multiple Choice,No Chart,Short
problem566,"There are two kinds of failures: those who thought and never did, and those who did and never thought.",566,Laurence J. Peter,"Trignometry,Arithmetic,No Calculator,Grid-In,Chart,Short",,,Trignometry,Arithmetic,No Calculator,Grid-In,Chart,Short
problem567,I'm not interested in age. People who tell me their age are silly. You're as old as you feel.,567,Elizabeth Arden,"No Calculator,Grid-In,No Chart,Long",,,,,No Calculator,Grid-In,No Chart,Long
problem568,"I find hope in the darkest of days, and focus in the brightest. I do not judge the universe.",568,Dalai Lama,"Algebra,No Calculator,Grid-In,No Chart,Long",Algebra,,,,No Calculator,Grid-In,No Chart,Long
problem569,"When it is obvious that the goals cannot be reached, don't adjust the goals, adjust the action steps.",569,Confucius,"Geometry,Trignometry,No Calculator,Multiple Choice,Chart,Short",,Geometry,Trignometry,,No Calculator,Multiple Choice,Chart,Short
problem570,"Our virtues and our failings are inseparable, like force and matter. When they separate, man is no more.",570,Nikola Tesla,"Algebra,Arithmetic,Calculator,Multiple Choice,No Chart,Long",Algebra,,,Arithmetic,Calculator,Multiple Choice,No Chart,Long
problem571,"Blessed is the person who is too busy to worry in the daytime, and too sleepy to worry at night.",571,Leo Aikman,"Geometry,Trignometry,Arithmetic,Calculator,Grid-In,No Chart,Short",,Geometry,Trignometry,Arithmetic,Calculator,Grid-In,No Chart,Short
problem572,"He can who thinks he can, and he can't who thinks he can't. This is an inexorable, indisputable law.",572,Pablo Picasso,"Geometry,No Calculator,Grid-In,Chart,Short",,Geometry,,,No Calculator,Grid-In,Chart,Short
problem573,"These days people seek knowledge, not wisdom. Knowledge is of the past, wisdom is of the future.",573,Vernon Cooper,"Algebra,Geometry,Trignometry,Arithmetic,Calculator,Multiple Choice,Chart,Long",Algebra,Geometry,Trignometry,Arithmetic,Calculator,Multiple Choice,Chart,Long
problem574,One secret of success in life is for a man to be ready for his opportunity when it comes.,574,Benjamin Disraeli,"Trignometry,Arithmetic,Calculator,Grid-In,Chart,Short",,,Trignometry,Arithmetic,Calculator,Grid-In,Chart,Short
problem575,People take different roads seeking fulfilment and happiness. Just because theyre not on your road doesn't mean they've gotten lost.,575,Dalai Lama,"Algebra,Trignometry,Calculator,Multiple Choice,Chart,Short",Algebra,,Trignometry,,Calculator,Multiple Choice,Chart,Short
problem576,The shoe that fits one person pinches another; there is no recipe for living that suits all cases.,576,Carl Jung,"Algebra,Geometry,No Calculator,Multiple Choice,No Chart,Short",Algebra,Geometry,,,No Calculator,Multiple Choice,No Chart,Short
problem577,"There are only two mistakes one can make along the road to truth; not going all the way, and not starting.",577,Buddha,"Algebra,Geometry,Trignometry,Calculator,Multiple Choice,No Chart,Long",Algebra,Geometry,Trignometry,,Calculator,Multiple Choice,No Chart,Long
problem578,"Very little is needed to make a happy life; it is all within yourself, in your way of thinking.",578,Marcus Aurelius,"Geometry,Trignometry,Arithmetic,No Calculator,Grid-In,No Chart,Short",,Geometry,Trignometry,Arithmetic,No Calculator,Grid-In,No Chart,Short
problem579,Giving up doesn't always mean you are weak. Sometimes it means that you are strong enough to let go.,579,Master Yoda,"Algebra,Geometry,Trignometry,No Calculator,Multiple Choice,No Chart,Long",Algebra,Geometry,Trignometry,,No Calculator,Multiple Choice,No Chart,Long
problem580,Treat people as if they were what they ought to be and you help them to become what they are capable of being.,580,Johann Wolfgang von Goethe,"Geometry,Trignometry,No Calculator,Multiple Choice,No Chart,Long",,Geometry,Trignometry,,No Calculator,Multiple Choice,No Chart,Long
problem581,"The most precious gift we can offer anyone is our attention. When mindfulness embraces those we love, they will bloom like flowers.",581,Thich Nhat Hanh,"Geometry,Trignometry,No Calculator,Grid-In,No Chart,Short",,Geometry,Trignometry,,No Calculator,Grid-In,No Chart,Short
problem582,"If you focus on results, you will never change. If you focus on change, you will get results.",582,Jack Dixon,"Geometry,Arithmetic,No Calculator,Multiple Choice,No Chart,Long",,Geometry,,Arithmetic,No Calculator,Multiple Choice,No Chart,Long
problem583,"I would maintain that thanks are the highest form of thought, and that gratitude is happiness doubled by wonder.",583,G. K. Chesterton,"Trignometry,Arithmetic,No Calculator,Grid-In,No Chart,Long",,,Trignometry,Arithmetic,No Calculator,Grid-In,No Chart,Long
problem584,"There are two primary choices in life: to accept conditions as they exist, or accept the responsibility for changing them.",584,Denis Waitley,"Calculator,Multiple Choice,No Chart,Long",,,,,Calculator,Multiple Choice,No Chart,Long
problem585,"All difficult things have their origin in that which is easy, and great things in that which is small.",585,Lao-Tzu,"Algebra,Geometry,Trignometry,Calculator,Multiple Choice,Chart,Long",Algebra,Geometry,Trignometry,,Calculator,Multiple Choice,Chart,Long
problem586,You can be what you want to be. You have the power within and we will help you always.,586,Byron Pulsifer,"Geometry,Trignometry,Calculator,Grid-In,No Chart,Long",,Geometry,Trignometry,,Calculator,Grid-In,No Chart,Long
problem587,"To speak gratitude is courteous and pleasant, to enact gratitude is generous and noble, but to live gratitude is to touch Heaven.",587,Johannes Gaertner,"Algebra,Arithmetic,No Calculator,Grid-In,No Chart,Short",Algebra,,,Arithmetic,No Calculator,Grid-In,No Chart,Short
problem588,Wisdom is the reward you get for a lifetime of listening when you'd have preferred to talk.,588,Doug Larson,"Algebra,Geometry,Trignometry,Calculator,Multiple Choice,No Chart,Short",Algebra,Geometry,Trignometry,,Calculator,Multiple Choice,No Chart,Short
problem589,"The greatest pleasure I know is to do a good action by stealth, and to have it found out by accident.",589,Charles Lamb,"Geometry,Trignometry,Arithmetic,No Calculator,Grid-In,Chart,Short",,Geometry,Trignometry,Arithmetic,No Calculator,Grid-In,Chart,Short
