question_id,question_text,answer,question_title,hashtags,topics_algebra,topics_geometry,topics_trignometry,topics_arithmetic,calculator,answer_type,chart,length
problem809,"Happiness cannot be travelled to, owned, earned, worn or consumed. Happiness is the spiritual experience of living every minute with love, grace and gratitude.",809,Denis Waitley,"Algebra,Arithmetic,No Calculator,Multiple Choice,No Chart,Short",Algebra,,,Arithmetic,No Calculator,Multiple Choice,No Chart,Short
problem810,"Everyone should carefully observe which way his heart draws him, and then choose that way with all his strength.",810,Hasidic saying,"Geometry,Trignometry,No Calculator,Grid-In,No Chart,Long",,Geometry,Trignometry,,No Calculator,Grid-In,No Chart,Long
problem811,"When we quit thinking primarily about ourselves and our own self-preservation, we undergo a truly heroic transformation of consciousness.",811,Joseph Campbell,"Algebra,Geometry,Calculator,Grid-In,Chart,Long",Algebra,Geometry,,,Calculator,Grid-In,Chart,Long
problem812,Do not give your attention to what others do or fail to do; give it to what you do or fail to do.,812,Dhammapada,"Geometry,Trignometry,Calculator,Multiple Choice,No Chart,Long",,Geometry,Trignometry,,Calculator,Multiple Choice,No Chart,Long
problem813,Follow effective action with quiet reflection. From the quiet reflection will come even more effective action.,813,Peter Drucker,"Trignometry,Calculator,Grid-In,Chart,Long",,,Trignometry,,Calculator,Grid-In,Chart,Long
problem814,"Life's challenges are not supposed to paralyze you, they're supposed to help you discover who you are.",814,Bernice Reagon,"Calculator,Multiple Choice,No Chart,Short",,,,,Calculator,Multiple Choice,No Chart,Short
problem815,There is one thing you have got to learn about our movement. Three people are better than no people.,815,Fannie Hamer,"Trignometry,Arithmetic,Calculator,Grid-In,Chart,Short",,,Trignometry,Arithmetic,Calculator,Grid-In,Chart,Short
problem816,Happiness is a perfume you cannot pour on others without getting a few drops on yourself.,816,Ralph Waldo Emerson,"Algebra,Geometry,Trignometry,No Calculator,Multiple Choice,Chart,Short",Algebra,Geometry,Trignometry,,No Calculator,Multiple Choice,Chart,Short
problem817,"It is not the mistake that has the most power, instead, it is learning from the mistake to advance your own attributes.",817,Byron Roberts,"Geometry,Trignometry,Arithmetic,No Calculator,Multiple Choice,Chart,Short",,Geometry,Trignometry,Arithmetic,No Calculator,Multiple Choice,Chart,Short
problem818,The amount of happiness that you have depends on the amount of freedom you have in your heart.,818,Thich Nhat Hanh,"Trignometry,Arithmetic,No Calculator,Multiple Choice,No Chart,Short",,,Trignometry,Arithmetic,No Calculator,Multiple Choice,No Chart,Short
problem819,"Your vision will become clear only when you look into your heart. Who looks outside, dreams. Who looks inside, awakens.",819,Carl Jung,"No Calculator,Multiple Choice,No Chart,Short",,,,,No Calculator,Multiple Choice,No Chart,Short
problem820,Yesterday is history. Tomorrow is a mystery. And today? Today is a gift. That is why we call it the present.,820,Babatunde Olatunji,"Trignometry,No Calculator,Grid-In,No Chart,Long",,,Trignometry,,No Calculator,Grid-In,No Chart,Long
problem821,The way we communicate with others and with ourselves ultimately determines the quality of our lives.,821,Tony Robbins,"Algebra,Geometry,Trignometry,Arithmetic,Calculator,Grid-In,Chart,Long",Algebra,Geometry,Trignometry,Arithmetic,Calculator,Grid-In,Chart,Long
problem822,Sometimes it is better to lose and do the right thing than to win and do the wrong thing.,822,Tony Blair,"Algebra,Trignometry,Arithmetic,No Calculator,Grid-In,No Chart,Long",Algebra,,Trignometry,Arithmetic,No Calculator,Grid-In,No Chart,Long
problem823,"Let us always meet each other with smile, for the smile is the beginning of love.",823,Mother Teresa,"Algebra,Geometry,No Calculator,Grid-In,Chart,Short",Algebra,Geometry,,,No Calculator,Grid-In,Chart,Short
problem824,A bend in the road is not the end of the road...unless you fail to make the turn.,824,,"Algebra,Geometry,Calculator,Grid-In,Chart,Short",Algebra,Geometry,,,Calculator,Grid-In,Chart,Short
problem825,"We are what we repeatedly do. Excellence, then, is not an act, but a habit.",825,Aristotle,"Algebra,Trignometry,Calculator,Multiple Choice,No Chart,Long",Algebra,,Trignometry,,Calculator,Multiple Choice,No Chart,Long
problem826,Living at risk is jumping off the cliff and building your wings on the way down.,826,Ray Bradbury,"Calculator,Grid-In,No Chart,Long",,,,,Calculator,Grid-In,No Chart,Long
problem827,"In the depth of winter, I finally learned that there was within me an invincible summer.",827,Albert Camus,"Algebra,Geometry,Trignometry,No Calculator,Multiple Choice,No Chart,Short",Algebra,Geometry,Trignometry,,No Calculator,Multiple Choice,No Chart,Short
problem828,Wit lies in recognizing the resemblance among things which differ and the difference between things which are alike.,828,Madame de Stael,"Trignometry,No Calculator,Grid-In,Chart,Long",,,Trignometry,,No Calculator,Grid-In,Chart,Long
problem829,A failure is a man who has blundered but is not capable of cashing in on the experience.,829,Elbert Hubbard,"Algebra,Geometry,Trignometry,Calculator,Multiple Choice,No Chart,Long",Algebra,Geometry,Trignometry,,Calculator,Multiple Choice,No Chart,Long
problem830,"I cannot give you the formula for success, but I can give you the formula for failure: which is: Try to please everybody.",830,Herbert Swope,"Algebra,Calculator,Grid-In,No Chart,Short",Algebra,,,,Calculator,Grid-In,No Chart,Short
problem831,One who asks a question is a fool for five minutes; one who does not ask a question remains a fool forever.,831,,"Algebra,No Calculator,Grid-In,Chart,Short",Algebra,,,,No Calculator,Grid-In,Chart,Short
problem832,The power of intuitive understanding will protect you from harm until the end of your days.,832,Laozi,"Algebra,Geometry,Trignometry,Arithmetic,No Calculator,Multiple Choice,Chart,Short",Algebra,Geometry,Trignometry,Arithmetic,No Calculator,Multiple Choice,Chart,Short
problem833,The best thing about the future is that it only comes one day at a time.,833,Abraham Lincoln,"Algebra,Geometry,Trignometry,Arithmetic,Calculator,Multiple Choice,Chart,Long",Algebra,Geometry,Trignometry,Arithmetic,Calculator,Multiple Choice,Chart,Long
problem834,We have two ears and one mouth so that we can listen twice as much as we speak.,834,Epictetus,"Arithmetic,No Calculator,Grid-In,Chart,Long",,,,Arithmetic,No Calculator,Grid-In,Chart,Long
problem835,Fear of failure is one attitude that will keep you at the same point in your life.,835,Byron Pulsifer,"Geometry,No Calculator,Multiple Choice,Chart,Long",,Geometry,,,No Calculator,Multiple Choice,Chart,Long
problem836,Friends are those rare people who ask how we are and then wait to hear the answer.,836,Ed Cunningham,"Trignometry,Arithmetic,Calculator,Multiple Choice,Chart,Short",,,Trignometry,Arithmetic,Calculator,Multiple Choice,Chart,Short
problem837,"If we learn to open our hearts, anyone, including the people who drive us crazy, can be our teacher.",837,Pema Chodron,"No Calculator,Multiple Choice,Chart,Short",,,,,No Calculator,Multiple Choice,Chart,Short
problem838,People grow through experience if they meet life honestly and courageously. This is how character is built.,838,Eleanor Roosevelt,"Algebra,Trignometry,No Calculator,Multiple Choice,No Chart,Long",Algebra,,Trignometry,,No Calculator,Multiple Choice,No Chart,Long
problem839,"A hero is no braver than an ordinary man, but he is braver five minutes longer.",839,Ralph Waldo Emerson,"Arithmetic,No Calculator,Grid-In,No Chart,Long",,,,Arithmetic,No Calculator,Grid-In,No Chart,Long
problem840,"While we try to teach our children all about life, our children teach us what life is all about.",840,Angela Schwindt,"Geometry,Trignometry,Calculator,Grid-In,No Chart,Long",,Geometry,Trignometry,,Calculator,Grid-In,No Chart,Long
problem841,"When you dance, your purpose is not to get to a certain place on the floor. It's to enjoy each step along the way.",841,Wayne Dyer,"Geometry,Trignometry,Calculator,Grid-In,No Chart,Long",,Geometry,Trignometry,,Calculator,Grid-In,No Chart,Long
problem842,"Genuine love should first be directed at oneself, if we do not love ourselves, how can we love others?",842,Dalai Lama,"Algebra,Arithmetic,Calculator,Multiple Choice,No Chart,Long",Algebra,,,Arithmetic,Calculator,Multiple Choice,No Chart,Long
problem843,The Creator has not given you a longing to do that which you have no ability to do.,843,Orison Marden,"Geometry,Trignometry,No Calculator,Multiple Choice,No Chart,Long",,Geometry,Trignometry,,No Calculator,Multiple Choice,No Chart,Long
problem844,It's so simple to be wise. Just think of something stupid to say and then don't say it.,844,Sam Levenson,"Algebra,Arithmetic,No Calculator,Multiple Choice,Chart,Long",Algebra,,,Arithmetic,No Calculator,Multiple Choice,Chart,Long
problem845,"Consider that not only do negative thoughts and emotions destroy our experience of peace, they also undermine our health.",845,Dalai Lama,"Geometry,Arithmetic,No Calculator,Grid-In,No Chart,Long",,Geometry,,Arithmetic,No Calculator,Grid-In,No Chart,Long
problem846,"Until you make peace with who you are, you will never be content with what you have.",846,Doris Mortman,"Trignometry,No Calculator,Grid-In,Chart,Short",,,Trignometry,,No Calculator,Grid-In,Chart,Short
problem847,No one saves us but ourselves. No one can and no one may. We ourselves must walk the path.,847,Buddha,"Geometry,Trignometry,Arithmetic,Calculator,Grid-In,No Chart,Short",,Geometry,Trignometry,Arithmetic,Calculator,Grid-In,No Chart,Short
problem848,"The moment one gives close attention to anything, it becomes a mysterious, awesome, indescribably magnificent world in itself.",848,Henry Miller,"Algebra,Trignometry,Calculator,Multiple Choice,No Chart,Short",Algebra,,Trignometry,,Calculator,Multiple Choice,No Chart,Short
problem849,"Happiness is when what you think, what you say, and what you do are in harmony.",849,Mohandas Gandhi,"Trignometry,Arithmetic,Calculator,Grid-In,Chart,Short",,,Trignometry,Arithmetic,Calculator,Grid-In,Chart,Short
problem850,"The greatest antidote to insecurity and the sense of fear is compassion, it brings one back to the basis of one's inner strength",850,Dalai Lama,"Algebra,Geometry,Trignometry,Arithmetic,No Calculator,Grid-In,Chart,Long",Algebra,Geometry,Trignometry,Arithmetic,No Calculator,Grid-In,Chart,Long
problem851,"Courage is the discovery that you may not win, and trying when you know you can lose.",851,,"No Calculator,Grid-In,Chart,Long",,,,,No Calculator,Grid-In,Chart,Long
problem852,To be thoughtful and kind only takes a few seconds compared to the timeless hurt caused by one rude gesture.,852,Byron Pulsifer,"Calculator,Multiple Choice,No Chart,Short",,,,,Calculator,Multiple Choice,No Chart,Short
problem853,"The purpose of learning is growth, and our minds, unlike our bodies, can continue growing as we continue to live.",853,Mortimer Adler,"Geometry,Arithmetic,Calculator,Multiple Choice,No Chart,Short",,Geometry,,Arithmetic,Calculator,Multiple Choice,No Chart,Short
problem854,When you realize how perfect everything is you will tilt your head back and laugh at the sky.,854,Buddha,"Trignometry,Arithmetic,No Calculator,Multiple Choice,No Chart,Short",,,Trignometry,Arithmetic,No Calculator,Multiple Choice,No Chart,Short
problem855,"For every failure, there's an alternative course of action. You just have to find it. When you come to a roadblock, take a detour.",855,Mary Kay Ash,"Algebra,Arithmetic,Calculator,Grid-In,Chart,Short",Algebra,,,Arithmetic,Calculator,Grid-In,Chart,Short
problem856,"It is surprising what a man can do when he has to, and how little most men will do when they don't have to.",856,Walter Linn,"No Calculator,Multiple Choice,Chart,Short",,,,,No Calculator,Multiple Choice,Chart,Short
problem857,To be aware of a single shortcoming in oneself is more useful than to be aware of a thousand in someone else.,857,Tenzin Gyatso,"Arithmetic,Calculator,Grid-In,Chart,Long",,,,Arithmetic,Calculator,Grid-In,Chart,Long
problem858,Nobody made a greater mistake than he who did nothing because he could do only a little.,858,Edmund Burke,"Geometry,Trignometry,No Calculator,Multiple Choice,Chart,Short",,Geometry,Trignometry,,No Calculator,Multiple Choice,Chart,Short
problem859,"Constant kindness can accomplish much. As the sun makes ice melt, kindness causes misunderstanding, mistrust, and hostility to evaporate.",859,Albert Schweitzer,"Algebra,No Calculator,Multiple Choice,Chart,Long",Algebra,,,,No Calculator,Multiple Choice,Chart,Long
problem860,The greatest minds are capable of the greatest vices as well as of the greatest virtues.,860,Rene Descartes,"Geometry,Arithmetic,No Calculator,Multiple Choice,No Chart,Short",,Geometry,,Arithmetic,No Calculator,Multiple Choice,No Chart,Short
problem861,"A man should look for what is, and not for what he thinks should be.",861,Albert Einstein,"Algebra,Geometry,Arithmetic,No Calculator,Multiple Choice,Chart,Short",Algebra,Geometry,,Arithmetic,No Calculator,Multiple Choice,Chart,Short
problem862,"Difficulties are meant to rouse, not discourage. The human spirit is to grow strong by conflict.",862,William Channing,"Algebra,Geometry,Trignometry,Arithmetic,No Calculator,Multiple Choice,No Chart,Short",Algebra,Geometry,Trignometry,Arithmetic,No Calculator,Multiple Choice,No Chart,Short
problem863,If you have no respect for your own values how can you be worthy of respect from others.,863,Byron Pulsifer,"Geometry,Trignometry,Arithmetic,Calculator,Multiple Choice,No Chart,Long",,Geometry,Trignometry,Arithmetic,Calculator,Multiple Choice,No Chart,Long
problem864,Some people are always grumbling because roses have thorns; I am thankful that thorns have roses.,864,Alphonse Karr,"Algebra,Geometry,Arithmetic,No Calculator,Grid-In,No Chart,Short",Algebra,Geometry,,Arithmetic,No Calculator,Grid-In,No Chart,Short
problem865,"To choose what is difficult all ones days, as if it were easy, that is faith.",865,W. H. Auden,"Algebra,Geometry,No Calculator,Grid-In,Chart,Short",Algebra,Geometry,,,No Calculator,Grid-In,Chart,Short
problem866,Ability is what you're capable of doing. Motivation determines what you do.Attitude determines how well you do it.,866,Lou Holtz,"Trignometry,Arithmetic,No Calculator,Multiple Choice,Chart,Short",,,Trignometry,Arithmetic,No Calculator,Multiple Choice,Chart,Short
problem867,Do not be embarrassed by your mistakes. Nothing can teach us better than our understanding of them. This is one of the best ways of self-education.,867,Thomas Carlyle,"Algebra,Trignometry,Arithmetic,No Calculator,Grid-In,No Chart,Long",Algebra,,Trignometry,Arithmetic,No Calculator,Grid-In,No Chart,Long
problem868,"Thousands of candles can be lighted from a single candle, and the life of the candle will not be shortened. Happiness never decreases by being shared.",868,Buddha,"Algebra,Geometry,Trignometry,Arithmetic,Calculator,Grid-In,Chart,Long",Algebra,Geometry,Trignometry,Arithmetic,Calculator,Grid-In,Chart,Long
problem869,"I care not so much what I am to others as what I am to myself. I will be rich by myself, and not by borrowing.",869,Michel de Montaigne,"Calculator,Multiple Choice,Chart,Short",,,,,Calculator,Multiple Choice,Chart,Short
problem870,"Know that although in the eternal scheme of things you are small, you are also unique and irreplaceable, as are all your fellow humans everywhere in the world.",870,Margaret Laurence,"Algebra,Arithmetic,Calculator,Multiple Choice,Chart,Short",Algebra,,,Arithmetic,Calculator,Multiple Choice,Chart,Short
problem871,"To do all that one is able to do, is to be a man; to do all that one would like to do, is to be a god.",871,Napoleon Bonaparte,"No Calculator,Grid-In,Chart,Short",,,,,No Calculator,Grid-In,Chart,Short
problem872,"If you let go a little, you will have a little peace. If you let go a lot, you will have a lot of peace.",872,Ajahn Chah,"Algebra,Geometry,Arithmetic,Calculator,Grid-In,No Chart,Long",Algebra,Geometry,,Arithmetic,Calculator,Grid-In,No Chart,Long
problem873,"There is no need for temples, no need for complicated philosophies. My brain and my heart are my temples; my philosophy is kindness.",873,Dalai Lama,"Algebra,Arithmetic,No Calculator,Multiple Choice,Chart,Short",Algebra,,,Arithmetic,No Calculator,Multiple Choice,Chart,Short
problem874,"The spirit, the will to win, and the will to excel, are the things that endure. These qualities are so much more important than the events that occur.",874,Vincent Lombardi,"Algebra,Geometry,No Calculator,Multiple Choice,No Chart,Short",Algebra,Geometry,,,No Calculator,Multiple Choice,No Chart,Short
problem875,"Man is not sum of what he has already, but rather the sum of what he does not yet have, of what he could have.",875,Jean-Paul Sartre,"Geometry,Arithmetic,No Calculator,Multiple Choice,No Chart,Long",,Geometry,,Arithmetic,No Calculator,Multiple Choice,No Chart,Long
problem876,"Don't believe what your eyes are telling you. All they show is limitation. Look with your understanding, find out what you already know, and you'll see the way to fly.",876,Richard Bach,"Algebra,Trignometry,Arithmetic,No Calculator,Grid-In,Chart,Short",Algebra,,Trignometry,Arithmetic,No Calculator,Grid-In,Chart,Short
problem877,"I believe that we are solely responsible for our choices, and we have to accept the consequences of every deed, word, and thought throughout our lifetime.",877,Elisabeth Kubler-Ross,"Algebra,Geometry,Trignometry,Arithmetic,Calculator,Grid-In,Chart,Long",Algebra,Geometry,Trignometry,Arithmetic,Calculator,Grid-In,Chart,Long
problem878,Wishes can be your best avenue of getting what you want when you turn wishes into action. Action moves your wish to the forefront from thought to reality.,878,Byron Pulsifer,"Algebra,Arithmetic,No Calculator,Grid-In,Chart,Long",Algebra,,,Arithmetic,No Calculator,Grid-In,Chart,Long
problem879,"To understand the heart and mind of a person, look not at what he has already achieved, but at what he aspires to do.",879,Kahlil Gibran,"Algebra,Geometry,Calculator,Grid-In,No Chart,Short",Algebra,Geometry,,,Calculator,Grid-In,No Chart,Short
problem880,"I am of the opinion that my life belongs to the community, and as long as I live it is my privilege to do for it whatever I can.",880,Bernard Shaw,"Algebra,Calculator,Grid-In,Chart,Short",Algebra,,,,Calculator,Grid-In,Chart,Short
problem881,"Imagination is more important than knowledge. For while knowledge defines all we currently know and understand, imagination points to all we might yet discover and create.",881,Albert Einstein,"Geometry,Trignometry,No Calculator,Multiple Choice,No Chart,Long",,Geometry,Trignometry,,No Calculator,Multiple Choice,No Chart,Long
problem882,"When you see a good person, think of becoming like him. When you see someone not so good, reflect on your own weak points.",882,Confucius,"Algebra,Geometry,Trignometry,No Calculator,Grid-In,Chart,Long",Algebra,Geometry,Trignometry,,No Calculator,Grid-In,Chart,Long
problem883,"If one is estranged from oneself, then one is estranged from others too. If one is out of touch with oneself, then one cannot touch others.",883,Anne Lindbergh,"Algebra,Geometry,Trignometry,Calculator,Multiple Choice,No Chart,Long",Algebra,Geometry,Trignometry,,Calculator,Multiple Choice,No Chart,Long
problem884,Most of the important things in the world have been accomplished by people who have kept on trying when there seemed to be no hope at all.,884,Dale Carnegie,"Geometry,Trignometry,No Calculator,Multiple Choice,No Chart,Short",,Geometry,Trignometry,,No Calculator,Multiple Choice,No Chart,Short
problem885,"You may say Im a dreamer, but Im not the only one, I hope someday you will join us, and the world will live as one.",885,John Lennon,"Trignometry,Arithmetic,Calculator,Grid-In,No Chart,Short",,,Trignometry,Arithmetic,Calculator,Grid-In,No Chart,Short
problem886,"Happiness is as a butterfly which, when pursued, is always beyond our grasp, but which if you will sit down quietly, may alight upon you.",886,Nathaniel Hawthorne,"Geometry,Trignometry,Arithmetic,No Calculator,Grid-In,Chart,Long",,Geometry,Trignometry,Arithmetic,No Calculator,Grid-In,Chart,Long
problem887,"He who experiences the unity of life sees his own Self in all beings, and all beings in his own Self, and looks on everything with an impartial eye.",887,Buddha,"Algebra,No Calculator,Grid-In,Chart,Long",Algebra,,,,No Calculator,Grid-In,Chart,Long
problem888,"In the sky, there is no distinction of east and west; people create distinctions out of their own minds and then believe them to be true.",888,Buddha,"Geometry,Arithmetic,Calculator,Multiple Choice,No Chart,Short",,Geometry,,Arithmetic,Calculator,Multiple Choice,No Chart,Short
problem889,"You cannot change anything in your life with intention alone, which can become a watered-down, occasional hope that you'll get to tomorrow. Intention without action is useless.",889,Caroline Myss,"Geometry,Arithmetic,Calculator,Multiple Choice,Chart,Short",,Geometry,,Arithmetic,Calculator,Multiple Choice,Chart,Short
problem890,"Before you can inspire with emotion, you must be swamped with it yourself. Before you can move their tears, your own must flow. To convince them, you must yourself believe.",890,Winston Churchill,"Algebra,Geometry,Calculator,Grid-In,Chart,Short",Algebra,Geometry,,,Calculator,Grid-In,Chart,Short
problem891,"The greatest discovery of our generation is that human beings can alter their lives by altering their attitudes of mind. As you think, so shall you be.",891,William James,"Geometry,No Calculator,Grid-In,No Chart,Long",,Geometry,,,No Calculator,Grid-In,No Chart,Long
problem892,"If one advances confidently in the direction of his dream, and endeavours to live the life which he had imagines, he will meet with a success unexpected in common hours.",892,Henry David Thoreau,"Algebra,Arithmetic,Calculator,Multiple Choice,No Chart,Long",Algebra,,,Arithmetic,Calculator,Multiple Choice,No Chart,Long
problem893,"The secret of joy in work is contained in one word, excellence. To know how to do something well is to enjoy it.",893,Pearl Buck,"Algebra,Geometry,Arithmetic,No Calculator,Multiple Choice,No Chart,Short",Algebra,Geometry,,Arithmetic,No Calculator,Multiple Choice,No Chart,Short
problem894,"When you meet someone better than yourself, turn your thoughts to becoming his equal. When you meet someone not as good as you are, look within and examine your own self.",894,Confucius,"Algebra,Geometry,Trignometry,Arithmetic,No Calculator,Grid-In,Chart,Short",Algebra,Geometry,Trignometry,Arithmetic,No Calculator,Grid-In,Chart,Short
problem895,We must overcome the notion that we must be regular. It robs you of the chance to be extraordinary and leads you to the mediocre.,895,Uta Hagen,"Geometry,Arithmetic,No Calculator,Grid-In,Chart,Short",,Geometry,,Arithmetic,No Calculator,Grid-In,Chart,Short
problem896,"Most of our obstacles would melt away if, instead of cowering before them, we should make up our minds to walk boldly through them.",896,Orison Marden,"Trignometry,Arithmetic,Calculator,Grid-In,No Chart,Short",,,Trignometry,Arithmetic,Calculator,Grid-In,No Chart,Short
problem897,"Everything can be taken from a man but ... the last of the human freedoms, to choose ones attitude in any given set of circumstances, to choose ones own way.",897,Victor Frankl,"Trignometry,Calculator,Grid-In,No Chart,Short",,,Trignometry,,Calculator,Grid-In,No Chart,Short
problem898,"It is better to have enough ideas for some of them to be wrong, than to be always right by having no ideas at all.",898,Edward de Bono,"Algebra,Arithmetic,Calculator,Grid-In,Chart,Short",Algebra,,,Arithmetic,Calculator,Grid-In,Chart,Short
problem899,Character is like a tree and reputation like a shadow. The shadow is what we think of it; the tree is the real thing.,899,Abraham Lincoln,"Geometry,Trignometry,No Calculator,Grid-In,No Chart,Long",,Geometry,Trignometry,,No Calculator,Grid-In,No Chart,Long
problem900,By letting it go it all gets done. The world is won by those who let it go. But when you try and try. The world is beyond the winning.,900,Lao Tzu,"Arithmetic,Calculator,Grid-In,Chart,Short",,,,Arithmetic,Calculator,Grid-In,Chart,Short
problem901,"I am like a falling star who has finally found her place next to another in a lovely constellation, where we will sparkle in the heavens forever.",901,Amy Tan,"Algebra,Geometry,No Calculator,Multiple Choice,No Chart,Long",Algebra,Geometry,,,No Calculator,Multiple Choice,No Chart,Long
problem902,"Not every difficult and dangerous thing is suitable for training, but only that which is conducive to success in achieving the object of our effort.",902,Epictetus,"Algebra,Geometry,Trignometry,Arithmetic,Calculator,Multiple Choice,No Chart,Short",Algebra,Geometry,Trignometry,Arithmetic,Calculator,Multiple Choice,No Chart,Short
problem903,We are not animals. We are not a product of what has happened to us in our past. We have the power of choice.,903,Stephen Covey,"Geometry,Trignometry,Arithmetic,Calculator,Multiple Choice,Chart,Short",,Geometry,Trignometry,Arithmetic,Calculator,Multiple Choice,Chart,Short
problem904,"The most dangerous way to lose time is not to spend it having fun, but to spend it doing fake work. When you spend time having fun, you know you're being self-indulgent.",904,Paul Graham,"Arithmetic,Calculator,Multiple Choice,No Chart,Short",,,,Arithmetic,Calculator,Multiple Choice,No Chart,Short
problem905,"Thousands of candles can be lit from a single, and the life of the candle will not be shortened. Happiness never decreases by being shared.",905,Buddha,"Geometry,Arithmetic,No Calculator,Grid-In,Chart,Long",,Geometry,,Arithmetic,No Calculator,Grid-In,Chart,Long
